{
  "$schema": "https://json-schema.org/draft/2020-12/schema",
  "$id": "hadara.smokeEvidenceSummary.v1",
  "x-hadara-schema-id": "hadara.smokeEvidenceSummary.v1",
  "title": "HADARA Smoke Evidence Summary",
  "type": "object",
  "additionalProperties": true,
  "required": [
    "schemaVersion",
    "time",
    "taskId",
    "category",
    "sourceReport",
    "execution",
    "steps",
    "privacy",
    "issues",
    "rawLogsIncluded",
    "privatePathsIncluded",
    "rawPackageContentsIncluded"
  ],
  "properties": {
    "schemaVersion": { "const": "hadara.smokeEvidenceSummary.v1" },
    "time": { "type": "string", "minLength": 1 },
    "taskId": { "type": "string", "pattern": "^T-[0-9]{4}$" },
    "category": { "type": "string", "enum": ["package-smoke", "clean-checkout-smoke"] },
    "sourceReport": {
      "type": "object",
      "additionalProperties": true,
      "required": ["schemaVersion", "command", "mode", "ok"],
      "properties": {
        "schemaVersion": { "type": "string", "minLength": 1 },
        "command": { "type": "string", "minLength": 1 },
        "mode": { "type": "string", "minLength": 1 },
        "ok": { "type": "boolean" }
      }
    },
    "execution": { "type": "object", "additionalProperties": true },
    "steps": {
      "type": "array",
      "items": { "$ref": "#/$defs/step" }
    },
    "privacy": {
      "type": "object",
      "additionalProperties": true,
      "properties": {
        "rawLogsIncluded": { "const": false },
        "rawPackageContentsIncluded": { "const": false },
        "privatePathsIncluded": { "const": false },
        "environmentSecretsIncluded": { "const": false },
        "privateStorePathsIncluded": { "const": false }
      }
    },
    "issues": {
      "type": "array",
      "items": { "$ref": "#/$defs/issue" }
    },
    "rawLogsIncluded": { "const": false },
    "privatePathsIncluded": { "const": false },
    "rawPackageContentsIncluded": { "const": false }
  },
  "$defs": {
    "step": {
      "type": "object",
      "additionalProperties": true,
      "required": ["id", "label", "status", "summary"],
      "properties": {
        "id": { "type": "string", "minLength": 1 },
        "label": { "type": "string", "minLength": 1 },
        "status": { "type": "string", "enum": ["planned", "passed", "failed", "skipped"] },
        "exitCode": { "type": ["integer", "null"] },
        "elapsedMs": { "type": "integer" },
        "summary": { "type": "string", "minLength": 1 }
      }
    },
    "issue": {
      "type": "object",
      "additionalProperties": true,
      "required": ["severity", "code", "message"],
      "properties": {
        "severity": { "type": "string", "enum": ["warning", "error"] },
        "code": { "type": "string", "minLength": 1 },
        "message": { "type": "string", "minLength": 1 },
        "stepId": { "type": "string", "minLength": 1 }
      }
    }
  }
}
