{
  "schemaVersion": "hadara.smokeEvidenceSummary.v1",
  "time": "2026-07-07T14:14:16.881Z",
  "taskId": "T-0509",
  "category": "package-smoke",
  "sourceReport": {
    "schemaVersion": "hadara.packageSmoke.v1",
    "command": "package.smoke",
    "mode": "local",
    "ok": false,
    "provider": {
      "ecosystem": "npm",
      "smokeProfile": "npm-package-smoke",
      "command": "package.smoke"
    },
    "networkPolicy": {
      "mode": "environment-inherited",
      "enforced": false,
      "notes": [
        "Package-smoke commands inherit the current environment network behavior.",
        "HADARA does not enforce OS-level network isolation for local package tooling."
      ]
    }
  },
  "execution": {
    "npmPackExecuted": true,
    "packageInstallExecuted": true,
    "featureSmokeExecuted": true,
    "releaseMutationExecuted": false,
    "publishExecuted": false
  },
  "steps": [
    {
      "id": "validate-source",
      "label": "Validate package source",
      "status": "passed",
      "summary": "Package source metadata was checked without exposing package contents."
    },
    {
      "id": "plan-workspace",
      "label": "Prepare disposable workspace",
      "status": "passed",
      "summary": "Disposable package-smoke workspace was prepared outside the project source."
    },
    {
      "id": "npm-pack",
      "label": "npm pack",
      "status": "passed",
      "exitCode": 0,
      "elapsedMs": 1200,
      "summary": "npm pack produced a temporary package tarball."
    },
    {
      "id": "install-cli",
      "label": "Install package into isolated prefix",
      "status": "passed",
      "exitCode": 0,
      "elapsedMs": 1179,
      "summary": "Package installed into an isolated temporary prefix."
    },
    {
      "id": "doctor",
      "label": "Installed HADARA doctor",
      "status": "passed",
      "exitCode": 0,
      "elapsedMs": 62,
      "summary": "Installed hadara doctor exited successfully; stdout capture was empty in this environment."
    },
    {
      "id": "command-surface-drift",
      "label": "Command surface drift vs source registry",
      "status": "failed",
      "exitCode": 0,
      "elapsedMs": 53,
      "summary": "Installed command registry projection could not be parsed."
    },
    {
      "id": "generated-init-docs",
      "label": "Generated init docs current UX check",
      "status": "passed",
      "exitCode": 0,
      "elapsedMs": 56,
      "summary": "Generated init workflow docs expose current finalize --auto and slice guidance without stale removed-command instructions."
    },
    {
      "id": "feature-smoke-core",
      "label": "Core feature smoke via installed command",
      "status": "passed",
      "exitCode": 0,
      "elapsedMs": 76004,
      "summary": "Installed command-form core feature smoke exited successfully; stdout capture was empty in this environment."
    },
    {
      "id": "cleanup",
      "label": "Cleanup disposable workspace",
      "status": "passed",
      "summary": "Disposable workspace was removed."
    }
  ],
  "privacy": {
    "rawLogsIncluded": false,
    "rawPackageContentsIncluded": false,
    "privatePathsIncluded": false,
    "environmentSecretsIncluded": false,
    "privateStorePathsIncluded": false
  },
  "issues": [
    {
      "severity": "error",
      "code": "PACKAGE_SMOKE_SURFACE_PROBE_FAILED",
      "message": "Installed `hadara commands --json` output could not be parsed into registry entries.",
      "stepId": "command-surface-drift"
    }
  ],
  "rawLogsIncluded": false,
  "privatePathsIncluded": false,
  "rawPackageContentsIncluded": false
}