{
  "schemaVersion": "hadara.smokeEvidenceSummary.v1",
  "time": "2026-05-29T00:56:41.077Z",
  "taskId": "T-0142",
  "category": "package-smoke",
  "sourceReport": {
    "schemaVersion": "hadara.packageSmoke.v1",
    "command": "package.smoke",
    "mode": "local",
    "ok": true
  },
  "execution": {
    "npmPackExecuted": true,
    "packageInstallExecuted": true,
    "featureSmokeExecuted": true,
    "releaseMutationExecuted": false,
    "publishExecuted": false
  },
  "steps": [
    {
      "id": "validate-source",
      "label": "Validate package source",
      "status": "passed",
      "summary": "Package source metadata was checked without exposing package contents."
    },
    {
      "id": "plan-workspace",
      "label": "Prepare disposable workspace",
      "status": "passed",
      "summary": "Disposable package-smoke workspace was prepared outside the project source."
    },
    {
      "id": "npm-pack",
      "label": "npm pack",
      "status": "passed",
      "exitCode": 0,
      "elapsedMs": 192,
      "summary": "npm pack produced a temporary package tarball."
    },
    {
      "id": "install-cli",
      "label": "Install package into isolated prefix",
      "status": "passed",
      "exitCode": 0,
      "elapsedMs": 720,
      "summary": "Package installed into an isolated temporary prefix."
    },
    {
      "id": "doctor",
      "label": "Installed HADARA doctor",
      "status": "passed",
      "exitCode": 0,
      "elapsedMs": 92,
      "summary": "Installed hadara doctor returned an ok reduced JSON report."
    },
    {
      "id": "feature-smoke-core",
      "label": "Core feature smoke via installed command",
      "status": "passed",
      "exitCode": 0,
      "elapsedMs": 41324,
      "summary": "Installed command-form core feature smoke returned an ok reduced JSON report."
    },
    {
      "id": "cleanup",
      "label": "Cleanup disposable workspace",
      "status": "passed",
      "summary": "Disposable workspace was removed."
    }
  ],
  "privacy": {
    "rawLogsIncluded": false,
    "rawPackageContentsIncluded": false,
    "privatePathsIncluded": false,
    "environmentSecretsIncluded": false,
    "privateStorePathsIncluded": false
  },
  "issues": [],
  "rawLogsIncluded": false,
  "privatePathsIncluded": false,
  "rawPackageContentsIncluded": false
}