{
  "schemaVersion": "hadara.smokeEvidenceSummary.v1",
  "time": "2026-07-07T14:09:45.077Z",
  "taskId": "T-0509",
  "category": "package-smoke",
  "sourceReport": {
    "schemaVersion": "hadara.packageSmoke.v1",
    "command": "package.smoke",
    "mode": "local",
    "ok": false,
    "provider": {
      "ecosystem": "npm",
      "smokeProfile": "npm-package-smoke",
      "command": "package.smoke"
    },
    "networkPolicy": {
      "mode": "environment-inherited",
      "enforced": false,
      "notes": [
        "Package-smoke commands inherit the current environment network behavior.",
        "HADARA does not enforce OS-level network isolation for local package tooling."
      ]
    }
  },
  "execution": {
    "npmPackExecuted": true,
    "packageInstallExecuted": false,
    "featureSmokeExecuted": false,
    "releaseMutationExecuted": false,
    "publishExecuted": false
  },
  "steps": [
    {
      "id": "validate-source",
      "label": "Validate package source",
      "status": "passed",
      "summary": "Package source metadata was checked without exposing package contents."
    },
    {
      "id": "plan-workspace",
      "label": "Prepare disposable workspace",
      "status": "passed",
      "summary": "Disposable package-smoke workspace was prepared outside the project source."
    },
    {
      "id": "npm-pack",
      "label": "npm pack",
      "status": "failed",
      "exitCode": 226,
      "elapsedMs": 879,
      "summary": "npm pack did not produce a reduced tarball result."
    },
    {
      "id": "install-cli",
      "label": "Install package into isolated prefix",
      "status": "skipped",
      "summary": "Skipped because no package tarball was available."
    },
    {
      "id": "doctor",
      "label": "Installed HADARA doctor",
      "status": "skipped",
      "summary": "Skipped because no package tarball was available."
    },
    {
      "id": "command-surface-drift",
      "label": "Command surface drift vs source registry",
      "status": "skipped",
      "summary": "Skipped because no package tarball was available."
    },
    {
      "id": "generated-init-docs",
      "label": "Generated init docs current UX check",
      "status": "skipped",
      "summary": "Skipped because no package tarball was available."
    },
    {
      "id": "feature-smoke-core",
      "label": "Core feature smoke via installed command",
      "status": "skipped",
      "summary": "Skipped because no package tarball was available."
    },
    {
      "id": "cleanup",
      "label": "Cleanup disposable workspace",
      "status": "passed",
      "summary": "Disposable workspace was removed."
    }
  ],
  "privacy": {
    "rawLogsIncluded": false,
    "rawPackageContentsIncluded": false,
    "privatePathsIncluded": false,
    "environmentSecretsIncluded": false,
    "privateStorePathsIncluded": false
  },
  "issues": [
    {
      "severity": "error",
      "code": "PACKAGE_SMOKE_NPM_PACK_FAILED",
      "message": "npm pack failed or did not report a tarball.",
      "stepId": "npm-pack"
    }
  ],
  "rawLogsIncluded": false,
  "privatePathsIncluded": false,
  "rawPackageContentsIncluded": false
}