{
  "schemaVersion": "hadara.smokeEvidenceSummary.v1",
  "time": "2026-06-09T09:47:27.089Z",
  "taskId": "T-0287",
  "category": "clean-checkout-smoke",
  "sourceReport": {
    "schemaVersion": "hadara.cleanCheckoutSmoke.v1",
    "command": "smoke.cleanCheckout",
    "mode": "execute",
    "ok": false
  },
  "execution": {
    "sourceCopied": true,
    "dependencyInstallExecuted": true,
    "buildExecuted": true,
    "checkExecuted": true,
    "builtCliSmokeExecuted": false,
    "packageInstallExecuted": false,
    "releaseMutationExecuted": false,
    "publishExecuted": false
  },
  "steps": [
    {
      "id": "copy-source",
      "label": "Copy source checkout",
      "status": "passed",
      "summary": "Source checkout was copied into a disposable workspace without including dependency, build, local, or private store directories."
    },
    {
      "id": "npm-ci",
      "label": "Clean dependency install",
      "status": "passed",
      "exitCode": 0,
      "elapsedMs": 5054,
      "summary": "Clean dependency install completed successfully."
    },
    {
      "id": "build",
      "label": "Build clean checkout",
      "status": "passed",
      "exitCode": 0,
      "elapsedMs": 3893,
      "summary": "Build clean checkout completed successfully."
    },
    {
      "id": "check",
      "label": "Check clean checkout",
      "status": "failed",
      "exitCode": 1,
      "elapsedMs": 13473,
      "summary": "Check clean checkout failed with a reduced exit summary."
    },
    {
      "id": "doctor",
      "label": "Built CLI doctor",
      "status": "skipped",
      "summary": "Skipped because a previous clean-checkout step failed."
    },
    {
      "id": "ops-status",
      "label": "Built CLI operations status",
      "status": "skipped",
      "summary": "Skipped because a previous clean-checkout step failed."
    },
    {
      "id": "release-gate-strict",
      "label": "Built CLI strict release gate",
      "status": "skipped",
      "summary": "Skipped because a previous clean-checkout step failed."
    },
    {
      "id": "cleanup",
      "label": "Cleanup disposable workspace",
      "status": "passed",
      "summary": "Disposable clean checkout was removed."
    }
  ],
  "privacy": {
    "rawLogsIncluded": false,
    "privatePathsIncluded": false,
    "environmentSecretsIncluded": false,
    "privateStorePathsIncluded": false
  },
  "issues": [
    {
      "severity": "error",
      "code": "CLEAN_CHECKOUT_STEP_FAILED",
      "message": "npm run check failed during clean-checkout smoke.",
      "stepId": "check"
    }
  ],
  "rawLogsIncluded": false,
  "privatePathsIncluded": false,
  "rawPackageContentsIncluded": false
}