{
  "schemaVersion": "hadara.smokeEvidenceSummary.v1",
  "time": "2026-06-05T10:57:02.515Z",
  "taskId": "T-0268",
  "category": "package-smoke",
  "sourceReport": {
    "schemaVersion": "hadara.packageSmoke.v1",
    "command": "package.smoke",
    "mode": "local",
    "ok": false,
    "provider": {
      "ecosystem": "npm",
      "smokeProfile": "npm-package-smoke",
      "command": "package.smoke"
    },
    "networkPolicy": {
      "mode": "environment-inherited",
      "enforced": false,
      "notes": [
        "Package-smoke commands inherit the current environment network behavior.",
        "HADARA does not enforce OS-level network isolation for local package tooling."
      ]
    }
  },
  "execution": {
    "npmPackExecuted": true,
    "packageInstallExecuted": true,
    "featureSmokeExecuted": true,
    "releaseMutationExecuted": false,
    "publishExecuted": false
  },
  "steps": [
    {
      "id": "validate-source",
      "label": "Validate package source",
      "status": "passed",
      "summary": "Package source metadata was checked without exposing package contents."
    },
    {
      "id": "plan-workspace",
      "label": "Prepare disposable workspace",
      "status": "passed",
      "summary": "Disposable package-smoke workspace was prepared outside the project source."
    },
    {
      "id": "npm-pack",
      "label": "npm pack",
      "status": "passed",
      "exitCode": 0,
      "elapsedMs": 809,
      "summary": "npm pack produced a temporary package tarball."
    },
    {
      "id": "install-cli",
      "label": "Install package into isolated prefix",
      "status": "passed",
      "exitCode": 0,
      "elapsedMs": 1052,
      "summary": "Package installed into an isolated temporary prefix."
    },
    {
      "id": "doctor",
      "label": "Installed HADARA doctor",
      "status": "failed",
      "exitCode": 0,
      "elapsedMs": 93,
      "summary": "Installed doctor did not return an ok JSON report."
    },
    {
      "id": "feature-smoke-core",
      "label": "Core feature smoke via installed command",
      "status": "failed",
      "exitCode": 0,
      "elapsedMs": 44698,
      "summary": "Installed core feature smoke did not return an ok JSON report."
    },
    {
      "id": "cleanup",
      "label": "Cleanup disposable workspace",
      "status": "passed",
      "summary": "Disposable workspace retained because --keep-temp was set."
    }
  ],
  "privacy": {
    "rawLogsIncluded": false,
    "rawPackageContentsIncluded": false,
    "privatePathsIncluded": false,
    "environmentSecretsIncluded": false,
    "privateStorePathsIncluded": false
  },
  "issues": [
    {
      "severity": "error",
      "code": "PACKAGE_SMOKE_DOCTOR_FAILED",
      "message": "Installed hadara doctor failed or returned non-ok JSON.",
      "stepId": "doctor"
    },
    {
      "severity": "error",
      "code": "PACKAGE_SMOKE_FEATURE_SMOKE_FAILED",
      "message": "Installed core feature smoke failed or returned non-ok JSON.",
      "stepId": "feature-smoke-core"
    }
  ],
  "rawLogsIncluded": false,
  "privatePathsIncluded": false,
  "rawPackageContentsIncluded": false
}